{
  "authorization": {
    "authorized_by": "project-owner",
    "scope": "workflow-stages-only",
    "type": "human-delegation"
  },
  "auto_approval_conditions": {
    "block_statuses": [
      "FAIL",
      "NOT_RUN",
      "REVIEW_REQUIRED"
    ],
    "require_all_evidence_pass": true,
    "require_evidence_sha256": true
  },
  "human_approval_proof": "hmac-sha256",
  "mode": "autonomous-to-print-candidate",
  "policy_id": "MM-ORG-035-autonomous-to-print-candidate-v1",
  "project_id": "MM-ORG-035",
  "schema_version": "1.0",
  "stages": [
    {
      "approval": "agent",
      "evidence_mode": "agent-attestation",
      "id": "requirements-normalization",
      "require_hashed_report_inputs": false
    },
    {
      "approval": "agent",
      "evidence_mode": "agent-attestation",
      "id": "concept",
      "require_hashed_report_inputs": false
    },
    {
      "approval": "agent",
      "evidence_mode": "agent-attestation",
      "id": "decomposition",
      "require_hashed_report_inputs": false
    },
    {
      "approval": "agent",
      "evidence_mode": "deterministic-pass",
      "id": "parametric-source",
      "require_hashed_report_inputs": true
    },
    {
      "approval": "agent",
      "evidence_mode": "deterministic-pass",
      "id": "mesh-generation",
      "require_hashed_report_inputs": true
    },
    {
      "approval": "agent",
      "evidence_mode": "deterministic-pass",
      "id": "interface-validation",
      "require_hashed_report_inputs": true
    },
    {
      "approval": "agent",
      "evidence_mode": "deterministic-pass",
      "id": "slicer-preflight",
      "require_hashed_report_inputs": true
    },
    {
      "approval": "agent",
      "evidence_mode": "deterministic-pass",
      "id": "print-candidate",
      "require_hashed_report_inputs": true
    },
    {
      "approval": "human",
      "evidence_mode": "human-evidence",
      "id": "physical-print",
      "require_hashed_report_inputs": false
    },
    {
      "approval": "human",
      "evidence_mode": "human-evidence",
      "id": "fit-and-function",
      "require_hashed_report_inputs": false
    },
    {
      "approval": "human",
      "evidence_mode": "human-evidence",
      "id": "appearance",
      "require_hashed_report_inputs": false
    },
    {
      "approval": "human",
      "evidence_mode": "human-evidence",
      "id": "safety",
      "require_hashed_report_inputs": false
    },
    {
      "approval": "human",
      "evidence_mode": "human-evidence",
      "id": "commercial-release",
      "require_hashed_report_inputs": false
    }
  ],
  "tool_policy": {
    "dependency_install": "ask",
    "destructive_overwrite": "deny",
    "external_upload": "ask",
    "local_build_export_test": "allow",
    "local_workspace_write": "allow",
    "network": "ask",
    "printer_start": "deny",
    "printer_upload": "deny"
  }
}
